{
  "id": "example.server_version",
  "version": 1,
  "status": "example",
  "description": "Read-only example that is never eligible for execution.",
  "requirements": {
    "plugins": []
  },
  "execution": {
    "type": "command",
    "source": "player",
    "commandRoot": "version",
    "template": "/version"
  },
  "arguments": {},
  "effects": {
    "category": "READ",
    "scope": "request",
    "maximumBlocks": null
  },
  "permissions": {
    "minimum": "ANY"
  },
  "confirmation": {
    "required": false
  },
  "reversibility": {
    "type": "none"
  }
}
